<?xml version="1.0" encoding="UTF-8"?>
<xsd:schema targetNamespace="http://www.sdet-school2021.ru/xml/message"
            xmlns:xsd="http://www.w3.org/2001/XMLSchema"
            xmlns:tns="http://www.sdet-school2021.ru/xml/message">

    <xsd:complexType name="Message">
        <xsd:all>
            <xsd:element minOccurs="1" maxOccurs="1" name="messagedate" type="xsd:dateTime"/>
            <xsd:element minOccurs="1" maxOccurs="1" name="surname" type="xsd:string"/>
            <xsd:element minOccurs="1" maxOccurs="1" name="name" type="xsd:string"/>
            <xsd:element minOccurs="1" maxOccurs="1" name="patronymic" type="xsd:string"/>
            <xsd:element minOccurs="1" maxOccurs="1" name="postaladdress" type="xsd:string"/>
            <xsd:element minOccurs="1" maxOccurs="1" name="email" type="xsd:string"/>
            <xsd:element minOccurs="1" maxOccurs="1" name="department" type="tns:Department"/>
            <xsd:element minOccurs="1" maxOccurs="1" name="text" type="xsd:string"/>
            <xsd:element minOccurs="0" maxOccurs="1" name="filename" type="xsd:string"/>
            <xsd:element name="filedata" type="xsd:base64Binary" minOccurs="0" maxOccurs="1"/>
        </xsd:all>
    </xsd:complexType>

    <xsd:complexType name="Department">
        <xsd:all>
            <xsd:element name="name" type="xsd:string"/>
            <xsd:element name="population" type="xsd:int"/>
        </xsd:all>
    </xsd:complexType>

    <xsd:element name="message" type="tns:Message"/>

</xsd:schema>