<?xml version="1.0" encoding="UTF-8" standalone="no"?><ss:message xmlns:ss="http://www.sdet-school2021.ru/xml/message" xmlns:xsi="http://www.w3.org/2001/XMLSchema-instance" xsi:schemaLocation="http://www.sdet-school2021.ru/xml/message Message.xsd">

    <messagedate>2022-06-16T22:00:00</messagedate>
    <surname>Yeltcin</surname>
    <name>Boris</name>
    <patronymic>Nikolayevich</patronymic>
    <postaladdress>Санкт-Петербург, ул.Зенитчиков, д.23, кв. 59</postaladdress>
    <email>freedomrussia@ru.ru</email>
    <department>
        <name>${departmentName}</name>
        <population>5</population>
    </department>
    <text>Сообщение, по поводу которого мы должны согласовать наши позиции</text>
    <filename>svid.txt</filename>
    <filedata>0J/RgNC40LzQtdGA</filedata>

</ss:message>